<?xml version="1.0" encoding="utf-8" ?>
<SmokeTest xmlns="http://www.cloud.com/InputParameters.xsd"
           xmlns:xsi="http://www.w3.org/2001/XMLSchema-instance"
           xsi:schemaLocation="http://www.cloud.com InputParameters.xsd">
  <Copyright>
    <FileName>Settings.xml</FileName>
    <Copyright>Implementation of InputParameters.xsd XML Schema. Cloud. Copyright (c) Cloud.com. All rights reserved.</Copyright>
    <Creator>BobS</Creator>
  </Copyright>
  
  <InputParams>
    <API_Key>00d86d2ef9971f5f410480e6f82b49095ec11daa81e5702448f624d53460f42f</API_Key>
    <API_Secret>ad4b65f0d89ced24a9feaa5c93e970b8e1a43008d69ad20a6809ab18f6abb5dd</API_Secret>
    <ActiveSync_Folder>"C:\TestSyncBoxes\Auto_SyncBoxA"</ActiveSync_Folder>
    <ActiveSync_TraceFolder>"C:\TestSyncBoxes\Traces\AutoSyncTraces"</ActiveSync_TraceFolder>
    <ActiveSyncBoxID>372</ActiveSyncBoxID>
    <ManualSyncBoxID>372</ManualSyncBoxID>
    <ManualSync_Folder>"C:\Users\t_zacharyw\Cloud\"</ManualSync_Folder>
    <ManualSync_TraceFolder>"C:\TestSyncBoxes\Traces\ManualSyncTraces"</ManualSync_TraceFolder>
    <Token></Token>
    <TraceLevel>5</TraceLevel>
    <TraceType>4</TraceType>
    <FileNameMappingFile>"C:\Users\t_zacharyw\Cloud\NamingConflicts.xml"</FileNameMappingFile>
  </InputParams>
  <Scenario>
    <ScenarioTasks>
      <SmokeTask xsi:type="Creation">
          <type>Creation</type>
          <SyncType>Manual</SyncType>
          <InnerTask xsi:type="Rename">
            <type>Rename</type>
            <SyncType>Manual</SyncType>
            <InnerTask xsi:type="Deletion">
              <type>Deletion</type>
              <SyncType>Manual</SyncType>
              <InnerTask xsi:type="Comparison">
                <type>Comparison</type>
                <SyncType>Manual</SyncType>
                <ObjectType>
                  <type>None</type>
                </ObjectType>
                <SelectedSyncBoxID>371</SelectedSyncBoxID>
              </InnerTask>
              <ObjectType>
                <type>File</type>
              </ObjectType>
              <SelectedSyncBoxID>0</SelectedSyncBoxID>
              <Name>T1File12.txt</Name>
              <FullName>C:\Users\t_zacharyw\Cloud</FullName>
              <RelativePath>\T1File12.txt</RelativePath>
              <FullPath>C:\Users\t_zacharyw\Cloud\T1File12.txt</FullPath>
              <DeleteAll>false</DeleteAll>
              <DeleteCount>1</DeleteCount>
              <ID>0</ID>
              <ServerID>0</ServerID>
            </InnerTask>
            <ObjectType>
              <type>File</type>
            </ObjectType>
            <SelectedSyncBoxID>0</SelectedSyncBoxID>
            <OldName>T1File.txt</OldName>
            <NewName>T1File_Rename.txt</NewName>
            <RelativeDirectoryPath>\</RelativeDirectoryPath>
            <ServerID>0</ServerID>
          </InnerTask>
          <ObjectType>
            <type>File</type>
          </ObjectType>
          <SelectedSyncBoxID>0</SelectedSyncBoxID>
          <Name>T1File.txt</Name>
          <Path>C:\Users\t_zacharyw\Cloud</Path>
          <CreateNew>true</CreateNew>
      </SmokeTask>
      <SmokeTask xsi:type ="ListItems">
        <type>ListItems</type>
        <SyncType>Manual</SyncType>
        <InnerTask xsi:type="Deletion">
          <type>Deletion</type>
          <SyncType>Manual</SyncType>
          <InnerTask xsi:type="Creation">
            <type>Creation</type>
            <SyncType>Manual</SyncType>
            <InnerTask xsi:type="ListItems">
              <type>ListItems</type>
              <SyncType>Manual</SyncType>
              <ObjectType>
                <type>Session</type>
              </ObjectType>
              <SelectedSyncBoxID>0</SelectedSyncBoxID>
              <ListType>Sessions</ListType>
              <ExpectedCount>3</ExpectedCount>
            </InnerTask>
            <ObjectType>
              <type>Session</type>
            </ObjectType>
            <SelectedSyncBoxID>0</SelectedSyncBoxID>
            <Name></Name>
            <Path></Path>
            <CreateNew>true</CreateNew>
            <Count>3</Count>
          </InnerTask>
          <ObjectType>
            <type>Session</type>
          </ObjectType>
          <SelectedSyncBoxID>0</SelectedSyncBoxID>
          <Name></Name>
          <FullName></FullName>
          <RelativePath></RelativePath>
          <FullPath></FullPath>
          <DeleteAll>true</DeleteAll>
          <DeleteCount>0</DeleteCount>
          <ID>0</ID>
          <ServerID>0</ServerID>
        </InnerTask>
        <ObjectType>
          <type>Session</type>
        </ObjectType>
        <SelectedSyncBoxID>0</SelectedSyncBoxID>
        <ListType>Sessions</ListType>
        <ExpectedCount>0</ExpectedCount>
      </SmokeTask>
  </ScenarioTasks> 
</Scenario>
</SmokeTest>
